task_id,task_title,program,module,task_type,task_level,estimated_duration_minutes,description,task_objective,task_structure_summary,key_steps_summary,observable_behaviours_used,competency_domains_used,safety_elements_present,training_aids_used,complexity_level,quality_rating,notes_for_ai,source,status
ST-001,Perform Electrical Measurements in DC Circuits,EASA,Module 3 - Electrical Fundamentals,GP,L2,360,"Perform voltage, current, and resistance measurements",Apply electrical theory through practical measurement,Prep; Measurement; Instructor interaction; Debrief; Close-up,Build circuits; measure values; record; explain differences,OB 1.3; OB 1.5; OB 2.4; OB 2.6; OB 3.2; OB 4.2,C1;C2;C3;C4,PPE; electrical isolation; correct meter use; cleanup,training board; multimeter; resistors; power supply,medium,high,Good GP reference task,synthetic,approved
ST-002,Remove and Install Wheel Assembly,EASA,Module 7 - Maintenance Practices,R/I,L2,240,Remove and install wheel assembly,Apply correct sequence and tooling,Prep; Removal; Installation; Inspection; Close-up,Secure aircraft; remove wheel; install; torque; inspect,OB 1.1; OB 2.4; OB 2.6; OB 3.2,C1;C2;C3,PPE; stored energy control; tool control; cleanup,wheel mockup; tools; AMM extract,medium,high,Classic R/I task,synthetic,approved
ST-003,Perform Functional Test of Lighting Circuit,EASA,Module 11 - Electrical Systems,FOT,L3,180,Test lighting circuit functionality,Verify system performance against criteria,Prep; Setup; Test; Evaluation; Close-up,Configure circuit; energize; observe output; compare results,OB 1.3; OB 2.4; OB 3.2; OB 4.2,C1;C2;C3;C4,Electrical safety; correct setup; isolation; cleanup,test rig; multimeter; power supply,medium,high,Good FOT reference,synthetic,approved
ST-004,Troubleshoot Fault in DC Circuit,EASA,Module 3 - Electrical Fundamentals,TS,L3,200,Identify and isolate circuit fault,Apply troubleshooting logic,Prep; Symptom review; Diagnosis; Verification; Close-up,Analyze fault; test points; isolate cause; verify fix,OB 1.3; OB 2.4; OB 3.2; OB 4.2,C1;C2;C3;C4,Electrical safety; test discipline; isolation; cleanup,fault trainer; multimeter; diagrams,high,high,Good TS reference,synthetic,approved
ST-005,Identify Aircraft Control Surfaces,EASA,Module 6 - Aerodynamics,LOC,L2,90,Identify control surfaces and locations,Develop system awareness,Prep; Reference; Identification; Verification; Debrief,Locate surfaces; identify names; explain function,OB 1.2; OB 3.2,C1;C3,Safe access; area awareness,aircraft diagram; mockup,low,medium,Simple LOC task,synthetic,approved
